Title,URL,Sub
Learn about Current Digital Workplace Trends,https://www.futurelearn.com/courses/learn-about-current-digital-workplace-trends,
Dynamics 365: Customer Engagement for Sales,https://www.futurelearn.com/courses/customer-engagement-for-sales,
Dynamics 365: Implementing Power Platform Integrations,https://www.futurelearn.com/courses/cloudswyft-msft-dynamics-365-implementing-power-platform-int,
Dynamics 365: Testing and Deploying Power Platform Applications,https://www.futurelearn.com/courses/cloudswyft-msft-dynamics-365-testing-and-deploying-power-platform-app,
Dynamics 365: Using Power Platform Applications,https://www.futurelearn.com/courses/cloudswyft-msft-dynamics-365-using-power-platform-ap,
Dynamics 365: Working with Power Platform Automation,https://www.futurelearn.com/courses/cloudswyft-msft-dynamics-365-power-platform-auto,
Microsoft Dynamics 365 Fundamentals,https://www.futurelearn.com/courses/cloudswyft-msft-microsoft-dynamics-365-fund,
Microsoft Future Ready: Designing and Implementing a Data Science Solution on Azure,https://www.futurelearn.com/courses/designing-and-implementing-data-science-solution-on-azure-r,
Systems Thinking for Sustainability: Practical Application of the SiD Method,https://www.futurelearn.com/courses/systems-thinking-for-sustainability-framework-for-integrated-development,
Migrating to the AWS Cloud,https://www.futurelearn.com/courses/aws-cloud-migration,
Designing Infrastructure Solutions with Microsoft Azure Architecture,https://www.futurelearn.com/courses/introduction-azure-architect-technologies,
Introduction to Data Engineering with Microsoft Azure 1,https://www.futurelearn.com/courses/azure-for-data-engineer,
Version Control Essentials: Git and GitHub,https://www.futurelearn.com/courses/version-control-essentials-git-and-github,
Cloud Computing for Beginners,https://www.futurelearn.com/courses/cloud-computing-for-beginners,
"Google Classroom: Share, Collect, and Manage Student Work Online",https://www.futurelearn.com/courses/google-for-education-share-collect-and-manage-student-work-online-sc,
Microsoft Future Ready: Fundamentals of Internet of Things (IoT),https://www.futurelearn.com/courses/gettingstartedwiththeiot,
Dynamics 365: Working with Power Platform Automation,https://www.futurelearn.com/courses/cloudswyft-msft-dynamics-365-power-platform-auto-sc,
Programming Essentials with Python: Cloud Technology and SaaS,https://www.futurelearn.com/courses/programming-essentials-with-python-cloud-technology-and-saas-sc,
Programming Essentials with Python: Cloud Technology and SaaS,https://www.futurelearn.com/courses/programming-essentials-with-python-cloud-technology-and-saas,
Introduction to Data Science with Microsoft Azure,https://www.futurelearn.com/courses/cloudswyft-introduction-to-data-science-et,
Microsoft Future Ready: Designing and Implementing a Data Science Solution on Azure,https://www.futurelearn.com/courses/designing-and-implementing-data-science-solution-on-azure-et,
Microsoft Future Ready: Designing and Implementing a Data Science Solution on Azure,https://www.futurelearn.com/courses/designing-and-implementing-data-science-solution-on-azure-et2,
Collaborative Coding with Git,https://www.futurelearn.com/courses/collaborative-coding-with-git,
Computer Programming for Everyone,https://www.futurelearn.com/courses/computer-programming-for-everyone,
Getting Started with Your Raspberry Pi,https://www.futurelearn.com/courses/getting-started-with-your-raspberry-pi,
Introduction to JavaScript,https://www.futurelearn.com/courses/introduction-to-javascript-1,
Interview Preparation for Java Developers,https://www.futurelearn.com/courses/interview-preparation-for-java-developers,
A Beginner's Guide to C# and .NET,https://www.futurelearn.com/courses/a-beginners-guide-to-c-and-net,
How to Program in C++,https://www.futurelearn.com/courses/how-to-program-in-c-plus-plus,
"Introduction to VR Programming, Design, and Unity",https://www.futurelearn.com/courses/introduction-into-vr-programming-design-and-unity,
Start a CoderDojo Club,https://www.futurelearn.com/courses/start-a-coder-dojo,
Prepare for a Software Development Career,https://www.futurelearn.com/courses/software-development-python-java-prepare-for-a-software-development-career-sc,
Programming Applications with Python: Graphics User Interface (GUI),https://www.futurelearn.com/courses/programming-applications-with-python-graphics-user-interface-sc,
Programming Applications with Python: Libraries and Web Scraping,https://www.futurelearn.com/courses/programming-applications-with-python-libraries-and-web-scraping-sc,
Programming Applications with Python: Working with Files,https://www.futurelearn.com/courses/programming-applications-with-python-working-with-files-sc,
Programming Essentials with Python: Matplotlib and Seaborn,https://www.futurelearn.com/courses/programming-essentials-with-python-matplotlib-and-seaborn-sc,
Software Development: Understanding Python,https://www.futurelearn.com/courses/software-development-python-java-understanding-python-sc,
Information Security for Beginners,https://www.futurelearn.com/courses/information-security-for-beginners,
"People, Networks and Neighbours: Understanding Social Dynamics",https://www.futurelearn.com/courses/people-networks-and-neighbours,
Introduction to Programming with Python,https://www.futurelearn.com/courses/introduction-to-programming-with-python-fourth-rev-,
Fortran for Scientific Computing,https://www.futurelearn.com/courses/fortran-for-scientific-computing,
Introduction to Conversational Interfaces,https://www.futurelearn.com/courses/introduction-to-conversational-interfaces,
Learn to Code for the Web,https://www.futurelearn.com/courses/learn-to-code-for-the-web,
Prepare to Run a Code Club,https://www.futurelearn.com/courses/code-club,
Programming Applications with Python: Graphics User Interface (GUI),https://www.futurelearn.com/courses/programming-applications-with-python-graphics-user-interface,
Programming Applications with Python: Libraries and Web Scraping,https://www.futurelearn.com/courses/programming-applications-with-python-libraries-and-web-scraping,
Programming Applications with Python: Working with Files,https://www.futurelearn.com/courses/programming-applications-with-python-working-with-files,
Programming Essentials with Python: Matplotlib and Seaborn,https://www.futurelearn.com/courses/programming-essentials-with-python-matplotlib-and-seaborn,
Programming Essentials with Python: Source Code and Solutions Architecture,https://www.futurelearn.com/courses/programming-essentials-with-python-source-code-and-solutions-architecture,
Microsoft Future Ready: Data Science Research Methods Using Python Programming,https://www.futurelearn.com/courses/datasciemethodsonpl-ethics,
Data Query with Transact-SQL with Python,https://www.futurelearn.com/courses/querying-data-with-transact-sql-et2,
Microsoft Future Ready: Data Query with Transact-SQL (T-SQL),https://www.futurelearn.com/courses/querying-data-with-transact-sql-et,
Microsoft Future Ready: Data Science Research Methods on Python Programming,https://www.futurelearn.com/courses/cloudswyft-msft-dsrm-pythonedition,
Microsoft Future Ready: Introduction to Python Programming,https://www.futurelearn.com/courses/introduction-to-python-new,
Software Development Fundamentals: Programming Languages and HTML,https://www.futurelearn.com/courses/software-development-fundamentals-programming-languages-html,
Software Development Fundamentals: Project Management,https://www.futurelearn.com/courses/software-development-fundamentals-project-management,
Software Development Fundamentals: Web Accessibility and CSS,https://www.futurelearn.com/courses/software-development-fundamentals-web-accessibility-css,
Software Development with Python and Java: Introducing Java,https://www.futurelearn.com/courses/software-development-python-java-introducing-java,
Software Development with Python and Java: Prepare for a Software Development Career,https://www.futurelearn.com/courses/software-development-python-java-prepare-for-a-software-development-career,
Software Development with Python and Java: Understanding Python,https://www.futurelearn.com/courses/software-development-python-java-understanding-python,
Create Accessible Interfaces,https://www.futurelearn.com/courses/create-accessible-interfaces,
Learning in the Network Age,https://www.futurelearn.com/courses/learning-network-age,
Supercomputing,https://www.futurelearn.com/courses/supercomputing,
Understanding Quantum Computers,https://www.futurelearn.com/courses/intro-to-quantum-computing,
Ethical Hacking: An Introduction,https://www.futurelearn.com/courses/ethical-hacking-an-introduction,
The Cyber Security Landscape,https://www.futurelearn.com/courses/cyber-security-landscape,
Cyber Security Awareness and Solutions,https://www.futurelearn.com/courses/cyber-security-awareness-and-solutions,
How Cyber Security Affects the Software Development Life Cycle,https://www.futurelearn.com/courses/cyber-security-in-the-software-development-life-cycle-sc,
Secure System Analysis and Design,https://www.futurelearn.com/courses/system-analysis-and-design-sc,
Security System and Application Development,https://www.futurelearn.com/courses/system-development-sc,
System Security Testing and Maintenance,https://www.futurelearn.com/courses/system-testing-and-maintenance-sc,
Cryptography and Digital Certificates,https://www.futurelearn.com/courses/cryptography-and-digital-certificates-sc,
Introduction to Cyber Security,https://www.futurelearn.com/courses/introduction-to-cyber-security,
The Future of Cyber Security and Emerging Technologies,https://www.futurelearn.com/courses/the-future-of-cyber-security-sc,
Microsoft Future Ready: Fundamentals of Enterprise Security,https://www.futurelearn.com/courses/fundamentalsofenterprisesecurity,
Cyber Crime Investigation,https://www.futurelearn.com/courses/investigating-cybercrime-concepts,
Cyber Security Incident Response for Managers,https://www.futurelearn.com/courses/cyber-security-incident-response-for-managers,
Introduction to Digital Forensics: Malware Analysis and Investigations,https://www.futurelearn.com/courses/introduction-to-malware-investigations,
Practical: Malware Analysis and Investigations,https://www.futurelearn.com/courses/practical-malware-investigations,
ISO 27001: ISO Implementation Practitioner,https://www.futurelearn.com/courses/implementing-iso27001,
Advanced Cyber Security Training: Hands-On Password Attacks,https://www.futurelearn.com/courses/hands-on-password-attacks-and-security,
Advanced Cyber Security Training: Network Security,https://www.futurelearn.com/courses/securing-your-network-from-attacks,
Advanced Cyber Security Training: OWASP Top 10 and Web Application Fundamentals,https://www.futurelearn.com/courses/owasp-top-10-security-fundamentals,
Cryptography and Digital Certificates,https://www.futurelearn.com/courses/cryptography-and-digital-certificates-et,
Information Security Policy and Management,https://www.futurelearn.com/courses/digital-security-policy-and-management-et,
Risk Management and Security Vulnerabilities,https://www.futurelearn.com/courses/digital-risk-management-et,
The Cyber Security Landscape,https://www.futurelearn.com/courses/the-cyber-security-landscape-et,
The Future of Cyber Security and Emerging Technologies,https://www.futurelearn.com/courses/the-future-of-cyber-security-et,
Introduction to Network Security and Defence,https://www.futurelearn.com/courses/network-defence-management-overview-et,
Network Security and Defence: A History of IT,https://www.futurelearn.com/courses/history-of-networks-et,
Network Security and Defence: Network Environments,https://www.futurelearn.com/courses/network-environments-et,
Network Security and Defence: Security Architecture,https://www.futurelearn.com/courses/network-defence-architecture-et,
The Future of Network Security and Defence,https://www.futurelearn.com/courses/the-future-of-network-defence-management-et,
Current Issues in Secure Development,https://www.futurelearn.com/courses/big-issues-future-secure-development-et,
Cyber Security Foundations: Common Malware Attacks and Defense Strategies,https://www.futurelearn.com/courses/common-cybersecurity-attacks-and-defense-strategies,
Cyber Security Foundations: Identity and Access Management,https://www.futurelearn.com/courses/identity-and-access-management-part-1,
Cyber Security Foundations: Reinforcing Identity and Access Management,https://www.futurelearn.com/courses/identity-and-access-management-part-2,
Cyber Security Foundations: Why Cyber Security is Important,https://www.futurelearn.com/courses/introduction-to-cybersecurity,
How Cyber Security Affects the Software Development Life Cycle,https://www.futurelearn.com/courses/cyber-security-in-the-software-development-life-cycle-et,
Secure System Analysis and Design,https://www.futurelearn.com/courses/system-analysis-and-design-et,
Security System and Application Development,https://www.futurelearn.com/courses/system-development-et,
System Security Testing and Maintenance,https://www.futurelearn.com/courses/system-testing-and-maintenance-et,
Harnessing Emerging Disruptive Technologies,https://www.futurelearn.com/courses/introduction-to-emerging-disruptive-technologies,
A Beginner's Guide to Java Programming,https://www.futurelearn.com/courses/a-beginners-guide-to-java-programming,
How to Become a Java Developer,https://www.futurelearn.com/courses/how-to-become-a-java-developer,
Mobile and Web Testing with Selenium WebDriver and Java,https://www.futurelearn.com/courses/mobile-and-web-testing-with-selenium-webdriver-and-java,
Software Development: Introducing Java,https://www.futurelearn.com/courses/software-development-python-java-introducing-java-sc,
Introduction to Effective Network Analysis,https://www.futurelearn.com/courses/introduction-to-effective-network-analysis,
How to Pass IELTS: Writing,https://www.futurelearn.com/courses/how-to-pass-ielts-writing,
English Language Learning Through Sustainability,https://www.futurelearn.com/courses/english-language-for-sustainability,
Learn English Through TV Drama Series: Adrift,https://www.futurelearn.com/courses/learn-english-through-tv-drama-series-chasing-time-english,
Learn English Through TV Drama Series: My Name is Lucky,https://www.futurelearn.com/courses/my-name-is-lucky,
Learn English Through TV Drama Series: Skipper's Pass,https://www.futurelearn.com/courses/learn-english-through-tv-drama-series,
Improve your IELTS Speaking score,https://www.futurelearn.com/courses/improve-ielts-speaking,
Conversational Chinese: Leisure Activities and Daily Life,https://www.futurelearn.com/courses/conversational-chinese-leisure-activities-and-daily-life,
Introduction to the Chinese Language,https://www.futurelearn.com/courses/introduction-to-chinese-language,
HSK Standard Course Level 2: 2.2,https://www.futurelearn.com/courses/hsk-standard-course-level-2-2-2,
HSK Standard Course Level 2: 2.3,https://www.futurelearn.com/courses/hsk-standard-course-level-2-2-3,
Contemporary Chinese IV: 4.1,https://www.futurelearn.com/courses/contemporary-chinese-4-3-1,
Contemporary Chinese IV: 4.2,https://www.futurelearn.com/courses/contemporary-chinese-4-3-2,
HSK Standard Course Level 1: 1.1,https://www.futurelearn.com/courses/hsk-1-standard-course-1-1-,
HSK Standard Course Level 1: 1.2,https://www.futurelearn.com/courses/hsk-1-standard-course-1-2-,
HSK Standard Course Level 1: 1.3,https://www.futurelearn.com/courses/hsk-1-standard-course-1-3-,
Contemporary Chinese II: 2.1,https://www.futurelearn.com/courses/contemporary-chinese-2-1-3,
Contemporary Chinese II: 2.2,https://www.futurelearn.com/courses/contemporary-chinese-2-1-4,
Fall in Love with Mandarin,https://www.futurelearn.com/courses/fall-in-love-with-mandarin,
Contemporary Chinese I:  1.2,https://www.futurelearn.com/courses/contemporary-chinese-i-1-2,
Contemporary Chinese I: 1.1,https://www.futurelearn.com/courses/contemporary-chinese-i-1-1,
Learn Chinese: Introduction to Chinese Conversation,https://www.futurelearn.com/courses/chinese-conversation,
Learn Chinese: Introduction to Chinese Grammar,https://www.futurelearn.com/courses/chinese-grammar,
Learn Chinese: Introduction to Chinese Pronunciation and Tone,https://www.futurelearn.com/courses/chinese-pronunciation-tone,
A Beginner's Guide to Writing in English for University Study,https://www.futurelearn.com/courses/english-for-study,
English for Academic Study,https://www.futurelearn.com/courses/english-academic-study,
English Pronunciation in a Global World,https://www.futurelearn.com/courses/english-pronunciation,
EAL: English Language for Nature Conservation and Sustainability,https://www.futurelearn.com/courses/english-for-nature-conservation,
Learn English Through TV Drama Series: Upper Intermediate English Language,https://www.futurelearn.com/courses/learn-english-through-tv-drama-series-fortune-upper-intermediate-,
Practise your PTE Academic Speaking Skills,https://www.futurelearn.com/courses/skills-for-the-pte-speaking-test,
English for STEM: Understanding Maths Vocabulary,https://www.futurelearn.com/courses/english-for-stem-understanding-maths-vocabulary,
English for STEM: Understanding Engineering Vocabulary,https://www.futurelearn.com/courses/english-for-stem-understanding-engineering-vocabulary,
English for STEM: Understanding Science Vocabulary,https://www.futurelearn.com/courses/english-for-stem-understanding-science-vocabulary,
English for STEM: Understanding Technology Vocabulary,https://www.futurelearn.com/courses/english-for-stem-understanding-technology-vocabulary,
English as a Medium of Instruction for Academics,https://www.futurelearn.com/courses/emi-academics,
Basic English 1: Elementary,https://www.futurelearn.com/courses/basic-english-elementary,
Basic English 2: Pre-Intermediate,https://www.futurelearn.com/courses/basic-english-pre-intermediate,
An Intermediate Guide to Writing in English for University Study,https://www.futurelearn.com/courses/english-for-study-intermediate,
PTE Success: The Skills You Need,https://www.futurelearn.com/courses/pte-success,
Introduction to Intercultural Studies: Language and Culture,https://www.futurelearn.com/courses/intercultural-studies-language-culture,
Working with Translation: Theory and Practice,https://www.futurelearn.com/courses/working-with-translation,
Introduction to Comparative Indo-European Linguistics,https://www.futurelearn.com/courses/introduction-to-comparative-indo-european-linguistics,
Te Reo Māori: Introduction to Pronunciation,https://www.futurelearn.com/courses/te-reo-maori,
Teaching English Grammar in Context,https://www.futurelearn.com/courses/teaching-english-grammar-in-context,
Intermediate Korean: Exploring the Language and Culture of Korea,https://www.futurelearn.com/courses/intermediate-korean,
Multilingual Practices: Tackling Challenges and Creating Opportunities,https://www.futurelearn.com/courses/multilingual-practices,
Language Testing During Awake Brain Surgery,https://www.futurelearn.com/courses/awake-brain-surgery,
"An Introduction to Sociolinguistics: Accents, Attitudes and Identity",https://www.futurelearn.com/courses/accents-attitudes-and-identity-an-introduction-to-sociolinguistics,
Shakespeare's Language: Revealing Meanings and Exploring Myths,https://www.futurelearn.com/courses/shakespeares-language,
Let's Learn Portuguese Language,https://www.futurelearn.com/courses/lets-learn-portuguese-language,
Multiculturalism In ASEAN,https://www.futurelearn.com/courses/multiculturalism-in-asean,
Let's Learn Thai Language,https://www.futurelearn.com/courses/speak-like-thai-people,
Planet Earth: Understanding and Protecting our Environment,https://www.futurelearn.com/courses/planet-earth,
Understanding and Measuring the Earth’s Energy Imbalance,https://www.futurelearn.com/courses/understanding-and-measuring-the-earths-energy-imbalance,
Ecopedagogy for Beginners: Putting Climate Change Education Into Action,https://www.futurelearn.com/courses/ecopedagogy-for-beginners-putting-climate-change-education-into-action,
Unleash Your Potential: Sustainable Futures,https://www.futurelearn.com/courses/sustainable-futures,
Using Systems Thinking to Tackle the Climate and Biodiversity Crisis,https://www.futurelearn.com/courses/using-systems-thinking-to-tackle-the-climate-and-biodiversity-crisis,
Organising for the Sustainable Development Goals (SDGs),https://www.futurelearn.com/courses/organising-for-sustainable-development-goals,
Farm to Fork: Sustainable Food Production in a Changing Environment,https://www.futurelearn.com/courses/sustainable-agriculture-in-a-changing-environment,
Innovation in Arable Farming: Technologies for Sustainable Farming Systems,https://www.futurelearn.com/courses/innovation-in-arable-farming,
Sustainable Seafood: Barriers and Opportunities in the Fishing Industry,https://www.futurelearn.com/courses/sustainable-seafood,
Environmental Philosophy: Addressing Humanity's Most Urgent Challenges,https://www.futurelearn.com/courses/environmental-philosophy-addressing-humanity-s-most-urgent-challenges,
Renewable Energy: Sustainable Electricity Supply with Microgrids,https://www.futurelearn.com/courses/renewable-energy-sustainable-electricity-supply-with-microgrids,
Learning for a Sustainable Future: Live at COP27,https://www.futurelearn.com/courses/learning-live-at-cop,
Spatial Circularity Strategies 1: Introduction to Spatial Planning for a Circular Economy,https://www.futurelearn.com/courses/spatial-circularity-strategies-1-introduction-to-spatial-planning,
Spatial Circularity Strategies 2: Measuring Circularity Transitions,https://www.futurelearn.com/courses/circular-regions-2-measuring-circularity-transitions,
Spatial Circularity Strategies 3: Urban Metabolism and Methods for Systemic Analysis,https://www.futurelearn.com/courses/circular-regions-3-urban-metabolism-and-methods-for-systemic-analysis,
Spatial Circularity Strategies 4: Strategic Interventions for Spatial Planning,https://www.futurelearn.com/courses/circular-regions-4-strategic-interventions-for-spatial-planning,
Introduction to Climate Justice and Equity,https://www.futurelearn.com/courses/introduction-to-climate-justice-and-equity,
Introduction to Teaching Sustainability and Climate Action,https://www.futurelearn.com/courses/teaching-sustainability-climate-action-in-schools,
Uniting for a Sustainable Future: An Introduction to Global Sustainability,https://www.futurelearn.com/courses/united-for-a-sustainable-future-an-introduction,
Climate Solutions: Egypt,https://www.futurelearn.com/courses/climate-solutions-egypt,
"Thawing Permafrost: Science, Policy, and Environmental Justice in the Arctic",https://www.futurelearn.com/courses/thawing-permafrost-science-policy-and-environmental-justice-in-the-arctic,
Climate Change and Resilience in Food Systems,https://www.futurelearn.com/courses/climate-change-and-resilience-in-food-systems,
Communicating Climate Change for Effective Climate Action,https://www.futurelearn.com/courses/communicating-climate-change-raising-engagement-for-climate-action,
Environmental Ethics,https://www.futurelearn.com/courses/environmental-ethics,
Building a Sustainable Future with Technology,https://www.futurelearn.com/courses/building-a-sustainable-future-with-technology,
Global Inequalities and the Just Transition,https://www.futurelearn.com/courses/global-inequalities-and-the-just-transition,
A Beginner's Guide to Environmental Science: Wicked Problems and Possible Solutions,https://www.futurelearn.com/courses/introduction-to-environmental-science,
An Introduction to Sustainability in the Built Environment,https://www.futurelearn.com/courses/an-introduction-to-sustainability-in-the-built-environment,
Overpopulation: Resource Depletion and Human Innovation,https://www.futurelearn.com/courses/overpopulation-resource-depletion-and-human-innovation,
Solving Sustainability Challenges with Te Ao Māori (Māori World View),https://www.futurelearn.com/courses/te-pukenga-sustainability,
Sustainability and Biculturalism: Their Interrelationships and Impacts,https://www.futurelearn.com/courses/sustainability-biculturalism,
The Challenge of Global Water Security,https://www.futurelearn.com/courses/global-water-security,
Climate Solutions: UAE,https://www.futurelearn.com/courses/climate-solutions-uae,
Invisible Worlds: Understanding the Natural Environment,https://www.futurelearn.com/courses/invisible-worlds,
Mercados de Carbono: Lecciones Europeas para la Acción Climática Transnacional,https://www.futurelearn.com/courses/spanish-carbon-markets-examining-eu-policies,
Making Climate Adaptation Happen: Governing Transformation Strategies for Climate Change,https://www.futurelearn.com/courses/climate-adaptation-governance,
Carbon Markets: Examining EU Policies for Transnational Climate Action,https://www.futurelearn.com/courses/carbon-markets-examining-eu-policies,
Teaching Climate and Sustainability in Primary Schools: An Outdoor Learning Approach,https://www.futurelearn.com/courses/teaching-climate-and-sustainability-in-primary-schools,
Climate Change and Public Policy,https://www.futurelearn.com/courses/climate-change-and-public-policy,
Exploring Possible Futures: Modeling in Environmental and Energy Economics,https://www.futurelearn.com/courses/exploring-possible-futures,
Climate Solutions: India,https://www.futurelearn.com/courses/climate-solutions-india,
Sustainable Cities: Governing Urban Adaptation Under Climate Change,https://www.futurelearn.com/courses/governing-urban-adaptation,
Championing Change: Human Rights and the Climate Crisis,https://www.futurelearn.com/courses/climate-change-human-rights,
Real Climate Action: How to Engage People in Climate Change,https://www.futurelearn.com/courses/engage-people-in-climate-change,
