Title,URL,Sub
Marketing: Customer Needs and Wants,https://www.coursera.org/learn/marketing-customers?specialization=foundations-management,Business Strategy
Finance of Mergers and Acquisitions: Designing an M&A Deal,https://www.coursera.org/learn/mergers-acquisitions-ma-deal?specialization=mergersandacquisitions,Finance
International B2B (Business to Business) Marketing,https://www.coursera.org/learn/b2b-marketing?specialization=international-marketing,Marketing
Google Slides en Español,https://www.coursera.org/learn/google-slides-es?specialization=getting-started-with-google-workspace-es,Cloud Computing
Federal Taxation II: Property Transactions of Business Owners and Shareholders,https://www.coursera.org/learn/federal-taxation-business?specialization=united-states-federal-taxation,Business Essentials
Genomic Data Science and Clustering (Bioinformatics V),https://www.coursera.org/learn/genomic-data?specialization=bioinformatics,Health Informatics
Songwriting: Writing the Music,https://www.coursera.org/learn/songwriting-writing-the-music?specialization=songwriting,Music and Art
Supply Chain Operations,https://www.coursera.org/learn/operations?specialization=supply-chain-management,Business Strategy
Six Sigma Advanced Improve and Control Phases,https://www.coursera.org/learn/six-sigma-improve-control-advanced?specialization=six-sigma-green-belt,Leadership and Management
Architecting with Google Kubernetes Engine: Workloads,https://www.coursera.org/learn/deploying-workloads-google-kubernetes-engine-gke?specialization=architecting-google-kubernetes-engine,Software Development
Data Science as a Field,https://www.coursera.org/learn/data-science-as-a-field?specialization=vital-skills-for-data-science,Data Analysis
Network Analysis in Systems Biology,https://www.coursera.org/learn/network-biology?specialization=systems-biology,Basic Science
Advanced Interviewing Techniques,https://www.coursera.org/learn/interview-techniques?specialization=english-interview-resume,Learning English
Bring Your Story to Life – Video Post-Production,https://www.coursera.org/learn/bringing-your-story-to-life?specialization=the-art-of-visual-storytelling,Personal Development
IoT Networking,https://www.coursera.org/learn/iot-networking?specialization=uiuc-iot,Computer Security and Networks
Agile Planning for Software Products,https://www.coursera.org/learn/agile-planning-for-software-products?specialization=product-management,Software Development
Healthcare Data Literacy,https://www.coursera.org/learn/healthcare-data-literacy?specialization=healthcare-information-literacy-data-analytics,Health Informatics
Understanding Financial Markets,https://www.coursera.org/learn/understanding-financial-markets?specialization=investment-management,Finance
Applying Data Analytics in Marketing,https://www.coursera.org/learn/applying-data-analytics-business-in-marketing?specialization=analytics,Marketing
Statistics for Data Science with Python,https://www.coursera.org/learn/statistics-for-data-science-python?specialization=data-science-fundamentals-python-sql,Probability and Statistics
Managing an Agile Team,https://www.coursera.org/learn/uva-darden-agile-team-management?specialization=uva-darden-digital-product-management,Design and Product
"Excel/VBA for Creative Problem Solving, Part 2",https://www.coursera.org/learn/excel-vba-for-creative-problem-solving-part-2?specialization=excel-vba-creative-problem-solving,Algorithms
Developing Data Models with LookML,https://www.coursera.org/learn/developing-data-models-with-lookml?specialization=creating-business-value-with-data-and-looker,Data Analysis
Teach English Now! Capstone Project 2,https://www.coursera.org/learn/teaching-english-capstone-2?specialization=tesol-certificate-2,Learning English
Human Factors in AI,https://www.coursera.org/learn/human-factors-in-artificial-intelligence?specialization=ai-product-management-duke,Machine Learning
Input and Interaction,https://www.coursera.org/learn/interaction-techniques?specialization=interaction-design,Design and Product
Six Sigma Advanced Define and Measure Phases,https://www.coursera.org/learn/six-sigma-define-measure-advanced?specialization=six-sigma-green-belt,Leadership and Management
Robotics: Estimation and Learning,https://www.coursera.org/learn/robotics-learning?specialization=robotics,Mechanical Engineering
Networking in Google Cloud: Hybrid Connectivity and Network Management,https://www.coursera.org/learn/networking-gcp-hybrid-connectivity-network-management?specialization=networking-google-cloud-platform,Networking
Intro to International Marketing,https://www.coursera.org/learn/intro-international-marketing?specialization=international-marketing,Marketing
Artificial Intelligence: An Overview,https://www.coursera.org/learn/artificial-intelligence-an-overview?specialization=artificial-intelligence-overview,Algorithms
Getting Started with Git and GitHub,https://www.coursera.org/learn/getting-started-with-git-and-github?specialization=software-engineering-fundamentals,Software Development
Understanding TikTok and Its Users,https://www.coursera.org/learn/understanding-tiktok-and-its-users?specialization=marketing-with-tiktok,Marketing
Essential Design Principles for Tableau,https://www.coursera.org/learn/dataviz-design?specialization=data-visualization,Data Analysis
Effective Compliance Programs,https://www.coursera.org/learn/effective-compliance-programs?specialization=regulatory-compliance,Business Essentials
Customising your models with TensorFlow 2,https://www.coursera.org/learn/customising-models-tensorflow2?specialization=tensorflow2-deeplearning,Machine Learning
Healthcare Marketplace,https://www.coursera.org/learn/healthcare-marketplace?specialization=healthcare-marketplace,Finance
"Excel/VBA for Creative Problem Solving, Part 3 (Projects)",https://www.coursera.org/learn/excel-vba-for-creative-problem-solving-part-3-projects?specialization=excel-vba-creative-problem-solving,Algorithms
Supply Chain Management Strategy,https://www.coursera.org/learn/supply-chain-management-strategy?specialization=supply-chain-management,Business Strategy
Accounting Analysis I: The Role of Accounting as an Information System,https://www.coursera.org/learn/accounting-information-system?specialization=financial-reporting,Business Essentials
Teaching Popular Music in the Classroom,https://www.coursera.org/learn/teaching-popular-music?specialization=music-education,Education
Managing Employee Performance,https://www.coursera.org/learn/employee-performance?specialization=human-resource-management,Business Essentials
Design your own trading strategy – Culminating Project,https://www.coursera.org/learn/design-trading-strategy-culminating-project?specialization=trading-strategy,Finance
Digital Media and Marketing Principles,https://www.coursera.org/learn/marketing-channels?specialization=digital-marketing,Marketing
Introduction to Game Design,https://www.coursera.org/learn/game-design?specialization=game-design,Music and Art
Finding Mutations in DNA and Proteins (Bioinformatics VI),https://www.coursera.org/learn/dna-mutations?specialization=bioinformatics,Health Informatics
Experimental Methods in Systems Biology,https://www.coursera.org/learn/experimental-methods?specialization=systems-biology,Research
Supporting Families and Caregivers,https://www.coursera.org/learn/supporting-families-and-caregivers?specialization=palliative-care-always,Patient Care
Introduction to Hardware and Operating Systems,https://www.coursera.org/learn/introduction-to-hardware-and-operating-systems?specialization=it-cloud-fundamentals,Support and Operations
Introduction to Business Analytics with R,https://www.coursera.org/learn/business-analytics-r?specialization=analytics,Business Essentials
Probability Theory: Foundation for Data Science,https://www.coursera.org/learn/probability-theory-foundation-for-data-science?specialization=statistical-inference-for-data-science-applications,Probability and Statistics
Data Analysis with Python,https://www.coursera.org/learn/data-analysis-with-python?specialization=applied-data-science,Data Analysis
ESG Impact: Investor Perspective,https://www.coursera.org/learn/esg-impact-investor-perspective?specialization=materiality-esg-factors,Finance
Prediction Models with Sports Data,https://www.coursera.org/learn/prediction-models-sports-data?specialization=sports-analytics,Data Analysis
Planning your Client's Wealth over a 5-year Horizon,https://www.coursera.org/learn/wealth-planning-capstone?specialization=investment-management,Finance
Market Risk Management: Frameworks & Strategies,https://www.coursera.org/learn/market-risk-management?specialization=risk-management,Finance
Ethical Issues in Data Science,https://www.coursera.org/learn/ethical-issues-data-science?specialization=vital-skills-for-data-science,Data Analysis
Easing Physical Symptoms: It's Not Just Hospice Anymore,https://www.coursera.org/learn/easing-physical-symptoms?specialization=palliative-care,Patient Care
Arranging for Songwriters,https://www.coursera.org/learn/arranging-for-songwriters?specialization=music-education,Music and Art
Web Application Technologies and Django,https://www.coursera.org/learn/django-database-web-apps?specialization=django,Mobile and Web Development
Solving Problems with Creative and Critical Thinking,https://www.coursera.org/learn/solving-problems-with-creative-and-critical-thinking?specialization=people-and-soft-skills-for-professional-success,Personal Development
Sales Force Management,https://www.coursera.org/learn/sales-force-management?specialization=sales-operations,Leadership and Management
"Professional development: Improve yourself, always",https://www.coursera.org/learn/professional-development-improve-yourself?specialization=adapting-career-development,Leadership and Management
Financial Accounting Fundamentals,https://www.coursera.org/learn/uva-darden-financial-accounting?specialization=entrepreneurship-growing-your-business,Business Essentials
Business Transformation with Google Cloud,https://www.coursera.org/learn/business-transformation-google-cloud?specialization=digital-transformation-using-ai-ml-with-google-cloud,Business Strategy
Lessons on Wisdom: Personal Leadership for Your Life,https://www.coursera.org/learn/lessons-on-wisdom?specialization=strategic-leadership-impact-change-decision-making,Leadership and Management
Robotics: Computational Motion Planning,https://www.coursera.org/learn/robotics-motion-planning?specialization=robotics,Mechanical Engineering
The Role of Global Capital Markets,https://www.coursera.org/learn/capital-markets?specialization=learn-finance,Finance
Marketing on TikTok,https://www.coursera.org/learn/marketing-on-tiktok?specialization=marketing-with-tiktok,Marketing
Identifying Patient Populations,https://www.coursera.org/learn/computational-phenotyping?specialization=clinical-data-science,Data Analysis
Fitting Statistical Models to Data with Python,https://www.coursera.org/learn/fitting-statistical-models-data-python?specialization=statistics-with-python,Probability and Statistics
Positive Psychology: Martin E. P. Seligman’s Visionary Science,https://www.coursera.org/learn/positive-psychology-visionary-science?specialization=positivepsychology,Psychology
Digitalisation in Space Research,https://www.coursera.org/learn/space?specialization=aerospace,Mechanical Engineering
Perspective-Taking,https://www.coursera.org/learn/perspectivetaking?specialization=strategicthinkingforeveryone,Personal Development
Drug Discovery ,https://www.coursera.org/learn/drug-discovery?specialization=drug-development-product-management,Healthcare Management
Battery Pack Balancing and Power Estimation,https://www.coursera.org/learn/battery-pack-balancing-power-estimation?specialization=algorithms-for-battery-management-systems,Electrical Engineering
Social Marketing Capstone Project,https://www.coursera.org/learn/social-marketing-capstone?specialization=social-media-marketing,Marketing
"Musicianship: Chord Charts, Diatonic Chords, and Minor Keys",https://www.coursera.org/learn/musicianship-chords?specialization=musicianship-specialization,Music and Art
The Define Phase for the 6 σ Black Belt,https://www.coursera.org/learn/thedefinephaseforsixisgmablackbelt?specialization=six-sigma-black-belt,Business Essentials
Capstone: Your Story,https://www.coursera.org/learn/story-writing-project?specialization=creative-writing,Music and Art
SEL for Students: A Path to Social Emotional Well-Being,https://www.coursera.org/learn/sel-for-students?specialization=teacher-sel,Education
Applied Machine Learning in Python,https://www.coursera.org/learn/python-machine-learning?specialization=data-science-python,Data Analysis
Overview of Advanced Methods of Reinforcement Learning in Finance,https://www.coursera.org/learn/advanced-methods-reinforcement-learning-finance?specialization=machine-learning-reinforcement-finance,Algorithms
Teach English Now! Foundational Principles,https://www.coursera.org/learn/english-principles?specialization=tesol,Education
Statistical Inference for Estimation in Data Science,https://www.coursera.org/learn/statistical-inference-for-estimation-in-data-science?specialization=statistical-inference-for-data-science-applications,Probability and Statistics
Statistical Inference and Hypothesis Testing in Data Science Applications,https://www.coursera.org/learn/statistical-inference-and-hypothesis-testing-in-data-science-applications?specialization=statistical-inference-for-data-science-applications,Probability and Statistics
Cryptography,https://www.coursera.org/learn/cryptography?specialization=cyber-security,Computer Security and Networks
Information Design,https://www.coursera.org/learn/infodesign?specialization=interaction-design,Design and Product
Fashion Systems,https://www.coursera.org/learn/fashion-systems?specialization=transforming-fashion-business,Business Strategy
"Data Warehouse Concepts, Design, and Data Integration",https://www.coursera.org/learn/dwdesign?specialization=data-warehousing,Design and Product
"Developing AR/VR/MR/XR Apps with WebXR, Unity & Unreal",https://www.coursera.org/learn/develop-augmented-virtual-mixed-extended-reality-applications-webxr-unity-unreal?specialization=extended-reality-for-everybody,Design and Product
Brand Identity and Strategy,https://www.coursera.org/learn/brand-identity-strategy?specialization=branding-the-creative-journey,Marketing
"Conjunctions, Connectives, and Adverb Clauses",https://www.coursera.org/learn/conjunctions-connectives-adverb-clauses?specialization=advanced-grammar-punctuation,Learning English
Introduction to CSS3,https://www.coursera.org/learn/introcss?specialization=web-design,Mobile and Web Development
Software Development Processes and Methodologies,https://www.coursera.org/learn/software-processes?specialization=software-development-lifecycle,Software Development
Introduction to Machine Learning in Sports Analytics,https://www.coursera.org/learn/machine-learning-sports-analytics?specialization=sports-analytics,Data Analysis
Understanding and Visualizing Data with Python,https://www.coursera.org/learn/understanding-visualization-data?specialization=statistics-with-python,Data Analysis
Managing Talent,https://www.coursera.org/learn/managing-talent?specialization=leading-teams,Leadership and Management
Analyzing and Visualizing Data in Looker,https://www.coursera.org/learn/analyzing-and-visualizing-data-in-looker?specialization=creating-business-value-with-data-and-looker,Data Analysis
Excel Fundamentals for Data Analysis,https://www.coursera.org/learn/excel-data-analysis-fundamentals?specialization=excel-data-analytics-visualization,Business Essentials
"ETL and Data Pipelines with Shell, Airflow and Kafka",https://www.coursera.org/learn/etl-and-data-pipelines-shell-airflow-kafka?specialization=bi-foundations-sql-etl-data-warehouse,Data Management
Analysis and Interpretation of Data,https://www.coursera.org/learn/analysis-and-interpretation-of-data?specialization=market-research-market-research,Marketing
Agile Leadership: Introduction to Change,https://www.coursera.org/learn/agile-leadership-introduction-to-change?specialization=agile-leadership-change-management,Leadership and Management
"Create video, audio and infographics for online learning ",https://www.coursera.org/learn/create-video-audio-and-infographics-for-online-learning?specialization=online-learning-design-educators,Education
Singing Popular Music,https://www.coursera.org/learn/singing-popular-music?specialization=singer-songwriter,Music and Art
Investments I: Fundamentals of Performance Evaluation,https://www.coursera.org/learn/investments-fundamentals?specialization=financial-management,Finance
The Business of Product Management I,https://www.coursera.org/learn/the-business-of-product-management-one?specialization=real-world-product-management,Leadership and Management
Agile Software Development,https://www.coursera.org/learn/agile-software-development?specialization=software-development-lifecycle,Software Development
Applied Data Science for Data Analysts,https://www.coursera.org/learn/applied-data-science-for-data-analysts?specialization=data-science-with-databricks-for-data-analysts,Data Analysis
Financial Analysis of Scenarios and Decisions,https://www.coursera.org/learn/financial-analysis-of-scenarios-and-decisions?specialization=financial-analysis-skills-for-success,Business Essentials
Functional Programming in Scala Capstone,https://www.coursera.org/learn/scala-capstone?specialization=scala,Data Analysis
Understanding and Strengthening Health Systems,https://www.coursera.org/learn/health-systems?specialization=global-health,Public Health
Understanding Financial Statements: Company Performance,https://www.coursera.org/learn/income-statement?specialization=accounting-fundamentals,Business Essentials
Types of Conflict,https://www.coursera.org/learn/types-of-conflict?specialization=conflict-management,Business Essentials
Content Strategy for Professionals: Engaging Audiences,https://www.coursera.org/learn/engagement-strategy?specialization=content-strategy,Marketing
Big Data - Capstone Project,https://www.coursera.org/learn/big-data-project?specialization=big-data,Data Analysis
Inferential Statistics,https://www.coursera.org/learn/inferential-statistics?specialization=social-science,Probability and Statistics
Fundamentals of Scalable Data Science,https://www.coursera.org/learn/ds?specialization=advanced-data-science-ibm,Data Analysis
Uncommon Sense Teaching,https://www.coursera.org/learn/uncommon-sense-teaching?specialization=uncommon-sense-teaching-certificate,Education
Delivery Problem,https://www.coursera.org/learn/delivery-problem?specialization=discrete-mathematics,Algorithms
Creating Behavioral Change,https://www.coursera.org/learn/behavioral-change?specialization=abnormal-psychology,Psychology
Decentralized Applications (Dapps),https://www.coursera.org/learn/decentralized-apps-on-blockchain?specialization=blockchain,Software Development
Agile Meets Design Thinking,https://www.coursera.org/learn/uva-darden-getting-started-agile?specialization=agile-development,Design and Product
Flight Mechanics - Anemobarometry,https://www.coursera.org/learn/anemobarometry-flight-mechanics?specialization=flight-mechanics-fundamentals,Physics and Astronomy
Improving Communication Skills,https://www.coursera.org/learn/wharton-communication-skills?specialization=wharton-success,Personal Development
AI Workflow: Data Analysis and Hypothesis Testing,https://www.coursera.org/learn/ibm-ai-workflow-data-analysis-hypothesis-testing?specialization=ibm-ai-workflow,Machine Learning
Design Thinking: Discovery Tools,https://www.coursera.org/learn/uva-darden-design-thinking-discovery-tools?specialization=uva-darden-design-thinking,Business Strategy
Cognición encarnada,https://www.coursera.org/learn/cognicion?specialization=inteligencia-artificial,Algorithms
Foundations of Red Hat Cloud-native Development,https://www.coursera.org/learn/foundations-of-red-hat-cloud-native-development?specialization=cloud-native-development-openshift-kubernetes,Cloud Computing
Introduction to Artificial Intelligence (AI),https://www.coursera.org/learn/introduction-to-ai?specialization=digital-strategy,Machine Learning
Creating a Team Culture of Continuous Learning,https://www.coursera.org/learn/continuous-learning-culture?specialization=team-building,Leadership and Management
"Healthy Practices: Nutrition, Physical Activity, and Community and Family Participation",https://www.coursera.org/learn/healthy-practices-nutrition-physical-activity-community-family-participation?specialization=school-health-for-children-and-adolescents,Nutrition
Financial Acumen for Non-Financial Managers,https://www.coursera.org/learn/finance-healthcare-managers?specialization=healthcare-administration-management,Business Essentials
"High Performance Collaboration: Leadership, Teamwork, and Negotiation",https://www.coursera.org/learn/leadership-collaboration?specialization=organizational-leadership,Leadership and Management
Linux System Programming and Introduction to Buildroot,https://www.coursera.org/learn/linux-system-programming-introduction-to-buildroot?specialization=advanced-embedded-linux-development,Software Development
Fundamentals of Management,https://www.coursera.org/learn/fundamentals-of-management?specialization=career-success,Leadership and Management
"Engineering Project Management: Risk, Quality, Teams, and Procurement",https://www.coursera.org/learn/project-risk-quality-management?specialization=engineering-project-management,Leadership and Management
Introduction to Corporate Finance,https://www.coursera.org/learn/wharton-finance?specialization=finance-accounting,Finance
Statistical Inference,https://www.coursera.org/learn/statistical-inference?specialization=data-science-statistics-machine-learning,Probability and Statistics
Financial Analysis of Organizations,https://www.coursera.org/learn/financial-analysis-of-organizations?specialization=financial-analysis-skills-for-success,Business Essentials
Game Design and Development 3: 3D Shooter,https://www.coursera.org/learn/game-design-and-development-3?specialization=game-design-and-development,Software Development
Life Cycle Assessment,https://www.coursera.org/learn/life-cycle-assessment?specialization=healthy-sustainable-foods-products,Public Health
Generative Deep Learning with TensorFlow,https://www.coursera.org/learn/generative-deep-learning-with-tensorflow?specialization=tensorflow-advanced-techniques,Machine Learning
Value-Based Care: Organizational Competencies,https://www.coursera.org/learn/value-based-care-organizational-competencies?specialization=value-based-care,Public Health
AI Strategy and Governance,https://www.coursera.org/learn/wharton-ai-strategy-governance?specialization=ai-for-business-wharton,Machine Learning
Digital Product Management: Modern Fundamentals,https://www.coursera.org/learn/uva-darden-digital-product-management?specialization=leading-modern-day-business,Leadership and Management
Negotiation skills: Negotiate and resolve conflict,https://www.coursera.org/learn/negotiation-skills-conflict?specialization=influencing-storytelling-change-management,Business Essentials
Managing Big Data with MySQL,https://www.coursera.org/learn/analytics-mysql?specialization=excel-mysql,Data Analysis
"Journalism, the future, and you!",https://www.coursera.org/learn/international-journalism?specialization=become-a-journalist,Music and Art
Experiencing Design: Deepening Your Design Thinking Practice,https://www.coursera.org/learn/uva-darden-experiencing-design?specialization=uva-darden-design-thinking,Business Strategy
Successful Presentation,https://www.coursera.org/learn/presentation-skills?specialization=effective-business-communication,Business Essentials
Getting Started with Data Visualization in R,https://www.coursera.org/learn/jhu-getting-started-data-viz-r?specialization=jhu-data-visualization-dashboarding-with-r,Data Analysis
Java Programming: Solving Problems with Software,https://www.coursera.org/learn/java-programming?specialization=object-oriented-programming,Software Development
Simple Past Tense,https://www.coursera.org/learn/simple-past-tense?specialization=learn-english-beginning-grammar,Learning English
"Big Data, Artificial Intelligence, and Ethics",https://www.coursera.org/learn/big-data-ai-ethics?specialization=computational-social-science-ucdavis,Data Analysis
Supply Chain Analytics,https://www.coursera.org/learn/supply-chain-analytics?specialization=supply-chain-analytics,Business Essentials
"Smart Analytics, Machine Learning, and AI on Google Cloud",https://www.coursera.org/learn/smart-analytics-machine-learning-ai-gcp?specialization=gcp-data-machine-learning,Cloud Computing
Blockchain and Business,https://www.coursera.org/learn/blockchain-business?specialization=blockchain-revolution-enterprise,Business Essentials
Leading Positive Change through Appreciative Inquiry,https://www.coursera.org/learn/appreciative-inquiry?specialization=inspired-leadership,Leadership and Management
"Negotiation, Mediation, and Conflict Resolution - Capstone Project",https://www.coursera.org/learn/negotiation-project?specialization=negotiation-mediation-conflict-resolution,Leadership and Management
Strategy Formulation,https://www.coursera.org/learn/strategy-formulation?specialization=strategic-management,Business Strategy
Recording in Journals & Posting in Ledgers,https://www.coursera.org/learn/recording-business-transactions?specialization=accounting,Finance
Competitive Strategy and Organization Design Project,https://www.coursera.org/learn/organization-strategy-project?specialization=competitive-strategy,Business Strategy
